cwodtke	669550533972111360	Wed Nov 25 08:17:41 PST 2015	RT @Evolutionistrue: High Court rules that British schools must include humanism in religious studies https://t.co/DL04ZN4KcD
cwodtke	669550469325328384	Wed Nov 25 08:17:26 PST 2015	RT @dansolomon: “Women just make noise and ruin everything, right? Buy our fucking ridiculously expensive headphones!” https://t.co/kZ0c4y9…
cwodtke	669550385141432320	Wed Nov 25 08:17:06 PST 2015	RT @interacting: Quote of the Day: https://t.co/k0MR7xJ0kJ https://t.co/QY1BUrt2if
cwodtke	669549763646259204	Wed Nov 25 08:14:37 PST 2015	Tis the season to get autoresponders, tra la la la la and set some too!
cwodtke	669332432756170753	Tue Nov 24 17:51:02 PST 2015	Lost Treasures of Infocom - 9K of them-  are released to the public. Bless you, Meretzky https://t.co/Sk7Z6q8d7m
cwodtke	669305764788375553	Tue Nov 24 16:05:04 PST 2015	I dig this formula https://t.co/VBIKE5N6IB Reminds me of something https://t.co/cuQOOeMZbw
cwodtke	669304329099083776	Tue Nov 24 15:59:21 PST 2015	Be the whining you want to hear.
cwodtke	669302528199159808	Tue Nov 24 15:52:12 PST 2015	RT @AtiimHQ: OKRs are NOT Tasks!  https://t.co/H2Cb1p31mJ
cwodtke	669302247235260416	Tue Nov 24 15:51:05 PST 2015	RT @AtiimHQ: List of Top Companies That Use OKR Goals  https://t.co/z2CHsAnYfE
cwodtke	669299297834283008	Tue Nov 24 15:39:22 PST 2015	RT @RosenfeldMedia: Let @cagan @cwodtke @jeffpatton @tsharon @jboogie @lauraklein know what to cover at #ProductManagement + #UX conf:  htt…
cwodtke	669299224018681856	Tue Nov 24 15:39:04 PST 2015	Coming to a city near you: yet another extremely male conference https://t.co/ohqJTZdS64
cwodtke	669218319094779905	Tue Nov 24 10:17:35 PST 2015	What do you want to know about Product Management? https://t.co/eaZQgurav8
cwodtke	669217724682272768	Tue Nov 24 10:15:13 PST 2015	RT @jeffsussna: @cwodtke after which the masses carried them through the streets on their shoulders and showered them with confetti
cwodtke	669202116653658112	Tue Nov 24 09:13:12 PST 2015	Dreamed my students graduated and went to work on Apple, and bc they were junior they were stuck on iTunes. AND THEY FIXED IT.  Woke smiling.
cwodtke	669016513010003969	Mon Nov 23 20:55:41 PST 2015	Ok, this review puts it in context https://t.co/7bfxWvwD1G
cwodtke	669012281506697216	Mon Nov 23 20:38:52 PST 2015	Just caught up on Dr Who, and was disappointed. It just felt-- odd.
cwodtke	669000179542982656	Mon Nov 23 19:50:46 PST 2015	Why Pitching is Like Dating, blog post from my Creative Founder class https://t.co/RIFNBbIpX7
cwodtke	668917292349001729	Mon Nov 23 14:21:25 PST 2015	Best article on creating useful user research quick findings report?
cwodtke	668913664640966656	Mon Nov 23 14:07:00 PST 2015	Wonderful blog post from one of my students post David Shen's visit to our class https://t.co/z4id2KSTrz
cwodtke	668907966565756929	Mon Nov 23 13:44:21 PST 2015	RT @stevehickeydsgn: @cwodtke When my apprentices ignore me, the work suffers and it shows. But when they defy me? Some amazing things have…
cwodtke	668906389016723456	Mon Nov 23 13:38:05 PST 2015	Dear Students: Obedience is not a virtue.
cwodtke	668862162320781312	Mon Nov 23 10:42:21 PST 2015	If we build a design that manipulates users against their will, even if we are unconscious of it, it is still immoral. Inchworm tactics. 3/3
cwodtke	668861976299204608	Mon Nov 23 10:41:36 PST 2015	What if AB testing is leading companies like Facebook to accidentally design something that is unhealthily compulsive?  2/3
cwodtke	668861732874416128	Mon Nov 23 10:40:38 PST 2015	I've been thinking about how much Facebook usage looks like Operant Conditioning. I found it hard to get off, despite not enjoying it. 1/2
cwodtke	668838518576148481	Mon Nov 23 09:08:23 PST 2015	RT @BenKuchera: Non-comic Marvel stuff has a real problem coming up with a good villain. Jessica Jones does not have this problem.
cwodtke	668808959466192896	Mon Nov 23 07:10:56 PST 2015	RT @Salon: Donald Trump is now retweeting completely bogus crime statistics from neo-Nazi websites https://t.co/XIGvQb43NT https://t.co/in7…
cwodtke	668808634738937856	Mon Nov 23 07:09:39 PST 2015	.@codinghorror Itunes is a crime against humanity.     Ok, a misdemeanor against humanity, but still.
cwodtke	668808480581529601	Mon Nov 23 07:09:02 PST 2015	RT @codinghorror: I've been trying for three days now to restore my son's 64gb iPad from an iTunes backup (lots of apps). iTunes is history…
cwodtke	668550572681768960	Sun Nov 22 14:04:12 PST 2015	Onward! https://t.co/L66uCoJypl
cwodtke	668538610220593152	Sun Nov 22 13:16:40 PST 2015	Learning medieval bookbinding today. https://t.co/krclb3QPmB
cwodtke	668480363836997632	Sun Nov 22 09:25:13 PST 2015	RT @samswey: America 2015. https://t.co/WOoYq080l4
cwodtke	668479893064146944	Sun Nov 22 09:23:20 PST 2015	RT @Tin_Pixel: @cwodtke @FastCoDesign  They should do usability tests of old OS vs new OS to prove a point instead of adding more opinions …
cwodtke	668479790014271489	Sun Nov 22 09:22:56 PST 2015	RT @Tin_Pixel: @cwodtke @FastCoDesign my biggest gripe is the chart of principles that he uses as evidence that they focus on beauty.
cwodtke	668479468978114561	Sun Nov 22 09:21:39 PST 2015	RT @Tin_Pixel: @cwodtke @paulmcaleer I think it's easy to forget when iOS became a mess of arbitrary, ornamental linen in iOS 6
cwodtke	668454582310187009	Sun Nov 22 07:42:46 PST 2015	“Everything around you that you call life was made up by people … and you can change it.”   Steve Jobs
cwodtke	668170304779227136	Sat Nov 21 12:53:09 PST 2015	I have a theory that some people become "too big to edit" i.e. they are so famous no one will trim them back. Gladwell, Gopnik, Don Norman..
cwodtke	668164461958594560	Sat Nov 21 12:29:56 PST 2015	You know, I agree with this article https://t.co/385KemCz3j but it needed to be as third as long.
cwodtke	668164182261432320	Sat Nov 21 12:28:49 PST 2015	"If Apple were taking an elementary interaction design class, it would fail." https://t.co/Je6VJNzaIX via @fastcodesign
cwodtke	668163900953616384	Sat Nov 21 12:27:42 PST 2015	My Rajas en Creme con Pollo is the best.     That is all.
cwodtke	668143328441929728	Sat Nov 21 11:05:57 PST 2015	.@paulmcaleer Itunes is why I won't use Apple Pay.
cwodtke	668143185193889796	Sat Nov 21 11:05:23 PST 2015	RT @paulmcaleer: Apple nails stuff like how a hinge closes or weight of a mouse. Then they turn around and make Apple Music, or iTunes.
cwodtke	668143142990819328	Sat Nov 21 11:05:13 PST 2015	RT @paulmcaleer: But if I think of Apple as a fashion company, whew, it changes the whole equation. Then choosing beauty over usability mak…
cwodtke	668143045020225536	Sat Nov 21 11:04:50 PST 2015	RT @helenpremium: Information architecture and taxonomy matter. This CVS aisle is the equivalent of an "Other Resources" button. https://t.…
cwodtke	668142566127235072	Sat Nov 21 11:02:55 PST 2015	Hey Apple, remember this? Guess not.   https://t.co/385KemCz3j https://t.co/niM3XcVO7p
cwodtke	668142029193396224	Sat Nov 21 11:00:47 PST 2015	"Users must memorize these gestures after first being told, "read the manual" (what manual?)" https://t.co/385KemCz3j
cwodtke	668141890584248320	Sat Nov 21 11:00:14 PST 2015	"What kind of design philosophy requires millions of its users to have to pretend they are disabled in order to be able to use the product?"
cwodtke	668138930676477952	Sat Nov 21 10:48:29 PST 2015	"Apple has lost its way, driven by concern for style and appearance at the expense of understandability and usage." https://t.co/385KemCz3j
cwodtke	668135926464274434	Sat Nov 21 10:36:32 PST 2015	REQUIRED READING  How Apple is giving design a bad name https://t.co/Je6VJNzaIX by Don Norman and Bruce Tognazzini via @FastCoDesign
cwodtke	668126165584838656	Sat Nov 21 09:57:45 PST 2015	Why some games make you sad when you play them all the time: https://t.co/RVCv1m6qaN  (Hint: it's the Skinner box)
cwodtke	668113522753060864	Sat Nov 21 09:07:31 PST 2015	I put up a list of recommended Interactive Fiction/Narrative Games   https://t.co/ukoezfHevv if you need something to do over Thanksgiving
cwodtke	668110287514374145	Sat Nov 21 08:54:40 PST 2015	RT @jeffvandermeer: To justify me posting this, let's pretend the cat is a writer & the cucumbers are things that create writer's block. ht…
cwodtke	668110147831513088	Sat Nov 21 08:54:06 PST 2015	RT @jvaleski: Just had "the talk" w/ my daughter; complete w/ diagram. Everyone needs to know how this all works. #thenetwork https://t.co/…
cwodtke	668110050393632768	Sat Nov 21 08:53:43 PST 2015	RT @100978Marc: Une belle sketchnote en préparation pour le prochain article de @IsLifeSerious #todaysdoodle https://t.co/Fxcba8C3oc
cwodtke	667918714658951169	Fri Nov 20 20:13:25 PST 2015	and part two- more genuiser https://t.co/LTJWKN7AC1
cwodtke	667916161418301440	Fri Nov 20 20:03:16 PST 2015	if you have ever looked at Bartle's taxonomy of play, look again with Extra Credits. Brilliant https://t.co/NfaM81hve0
cwodtke	667867001100988416	Fri Nov 20 16:47:56 PST 2015	Had someone say they stopped playing games and reading fiction because they didn't want to waste their time and I died a little inside.
cwodtke	667789822052823040	Fri Nov 20 11:41:15 PST 2015	Making games in Foundations at @CCAIxD! https://t.co/D3Yp2y5piF
cwodtke	667729482237652992	Fri Nov 20 07:41:29 PST 2015	RT @bridgetkromhout: Printed up some DevOps Against Humanity cards, as one does. http://t.co/TX09SqiFMQ
cwodtke	667726236018302976	Fri Nov 20 07:28:35 PST 2015	RT @cynazem: Recommended by @berkun at #isa15 >> “Users don’t hate change. They hate you.” by @cwodtke https://t.co/pLEmbsHbsl
cwodtke	667695907014492161	Fri Nov 20 05:28:04 PST 2015	RT @tsharon: PM+UX virtual conference by @RosenfeldMedia. lineup: @lauraklein @cwodtke @jboogie @jeffpatton @cagan & yours truly. https://t…
cwodtke	667585397300424705	Thu Nov 19 22:08:56 PST 2015	I think what makes a great game designer is much what makes a great UX designer. Take a look: https://t.co/GGL3dfp2VW
cwodtke	667548573211299840	Thu Nov 19 19:42:36 PST 2015	The IxD class loved the four E's, @nerdyc and we added one more- Edge  But what were yours again? ;)
cwodtke	667548076148559872	Thu Nov 19 19:40:38 PST 2015	Loving this podcast https://t.co/ht9RRjXPIX by @amyjokim   She has a foot in game design and UX and product, so she connects all the dots.
cwodtke	667509378900062208	Thu Nov 19 17:06:52 PST 2015	RT @hunicke: Oh look - a GDC scholarship! Apply, come geek out with us about game dev and design! <3 https://t.co/WqqCY6UjdN
cwodtke	667508898698391553	Thu Nov 19 17:04:57 PST 2015	RT @OscarJoeRivas: The best and disruptive style workshop I have attended  @AlexOsterwalder #strategyzer #BMC THANKS ! https://t.co/jBL6As7…
cwodtke	667508669488062464	Thu Nov 19 17:04:03 PST 2015	RT @jenmylo: I would name it "Liar Docs" and there would be a bonus for when the text description and the screenshot don't match... but BOT…
cwodtke	667508656263401472	Thu Nov 19 17:04:00 PST 2015	RT @jenmylo: Relying on software documentation is always so painful. I need a drinking game for the number of times I yell, "Liar!" at the …
cwodtke	667439949013262336	Thu Nov 19 12:30:58 PST 2015	"You have to have design as a core team member as early as possible" Dave Shen @CCAIxD https://t.co/4BJOVvhUZr
cwodtke	667439340671365124	Thu Nov 19 12:28:33 PST 2015	Dave explains how funding has changed. It's gotten harder. @CCAIxD https://t.co/ftveJQbtKN
cwodtke	667435495996174336	Thu Nov 19 12:13:17 PST 2015	The wonderful Dave Shen talks about the startup ecosystem. @CCAIxD https://t.co/gTJZDGhJuq
cwodtke	667171974397865984	Wed Nov 18 18:46:08 PST 2015	What Dunbar's number really means for online connections, explained by....     Robin Dunbar.   https://t.co/uwbc4KG5p3
cwodtke	667160304262877184	Wed Nov 18 17:59:46 PST 2015	This talk by @danctheduck is one of the smartest social design talks I've ever seen https://t.co/kY1FR9dBkB (Vault only)
cwodtke	667113713476878336	Wed Nov 18 14:54:38 PST 2015	The Null Process explains why you want to actively design culture https://t.co/BjJqLhQKkx @davegray @AlexOsterwalder #leanstartupconference
cwodtke	667110552297041922	Wed Nov 18 14:42:04 PST 2015	The power of the BMC is firstly that it is visual. @AlexOsterwalder #leanstartupconference https://t.co/PtAxLfqfm3
cwodtke	667100734815518720	Wed Nov 18 14:03:03 PST 2015	Now @AlexOsterwalder is live drawing his presentation! (We need to introduce him to a ziggi. It's easier) https://t.co/dVSiXGlzo4
cwodtke	667098784606777344	Wed Nov 18 13:55:19 PST 2015	I'm getting a visual thinking vibe from @AlexOsterwalder https://t.co/BgZih8wAC8
cwodtke	667070766744080385	Wed Nov 18 12:03:59 PST 2015	I think #leanstartupconference has become innovators dilemma conference.
cwodtke	667064496658059265	Wed Nov 18 11:39:04 PST 2015	Hey #leanstartupconference @amyjokim has amazing article on all these topics here!  https://t.co/69DSxkjcSQ  I'm a big fan...
cwodtke	667063582488596482	Wed Nov 18 11:35:26 PST 2015	Loving @amyjokim's talk? Learn more! https://t.co/aiZbH0T6Nn
cwodtke	667060905369206784	Wed Nov 18 11:24:47 PST 2015	"Adverbs are a compression algorithm that is inherently lossy”  @howardtayler on @WritingExcuses   https://t.co/G1U76NfCVj
cwodtke	667059821389045760	Wed Nov 18 11:20:29 PST 2015	Get the Culture map https://t.co/bB1Fq1sTYV #leanstartupconference
cwodtke	667051009361899520	Wed Nov 18 10:45:28 PST 2015	"Curiosity and empathy lets you understand your customer's psche" @gaganbiyani #leanstartupconference
cwodtke	667050886154186752	Wed Nov 18 10:44:59 PST 2015	"People's ego gets so caught up in being right in front of their friends and family, they forget they are running a business" @gaganbiyani
cwodtke	667050505445617664	Wed Nov 18 10:43:28 PST 2015	Behind every great work is a great validation process.
cwodtke	667049986698293248	Wed Nov 18 10:41:24 PST 2015	The auteur genius creator is a rarity and a ineffective way to make great work, when it's not an outright myth.
cwodtke	667049785828839424	Wed Nov 18 10:40:36 PST 2015	This on the heels of listening to https://t.co/G1U76NfCVj where @MaryRobinette explains how she uses betareaders to debug her writing.
cwodtke	667049505771024384	Wed Nov 18 10:39:30 PST 2015	What does a writer want but to be heard, to make their point? What could be more valuable to know where in a story you were losing readers?
cwodtke	667049369275727872	Wed Nov 18 10:38:57 PST 2015	Watching @prernagupta's talk about using data to inform storytelling, I know think reader-centered writing is both possible and desirable.
cwodtke	667048746975256576	Wed Nov 18 10:36:29 PST 2015	If you can replace judgement with curiosity, you can learn amazing things, have grand adventures, and live a happier life.
cwodtke	667034447758274560	Wed Nov 18 09:39:39 PST 2015	I NEVER EVER NEVER NEVER EVER NEVER EVER thought I'd say this but I adore my surface 3 and the microsoft store. I am as shocked as you.
cwodtke	667033163621732352	Wed Nov 18 09:34:33 PST 2015	what makes games so compelling is your reward for success is a harder problem. Gamification doesn't get this. https://t.co/tIK28qTSrQ
cwodtke	667026456740913154	Wed Nov 18 09:07:54 PST 2015	You know when you are crazy about something, you think, why am I crazy for this, it makes no sense, and then you decide to just be happy?
cwodtke	667023869664849920	Wed Nov 18 08:57:37 PST 2015	Beloved followers, what would you pay to read a book on/take a class from me on?  I may have overdiversified my passions. ;)
cwodtke	667023141147820032	Wed Nov 18 08:54:44 PST 2015	RT @IanSchreiber: Someone make this: "A dating sim that starts after a video game hero has rescued a princess and realizes the princess jus…
cwodtke	667023082687627264	Wed Nov 18 08:54:30 PST 2015	Also, we know your work well enough to know it's not your work.  https://t.co/6zpAJUkvtc
cwodtke	667022823022399489	Wed Nov 18 08:53:28 PST 2015	RT @IanSchreiber: Now that I think about it, I'm surprised Gamestop doesn't shorten "pre-owned games" to "pwned games"...
cwodtke	667022411481542656	Wed Nov 18 08:51:50 PST 2015	I keep refinding this, and every time I'm like THIS OMG OMG https://t.co/H6DlxAi3Ff
cwodtke	667021296203468804	Wed Nov 18 08:47:24 PST 2015	Heading to Lean Startup happily. I love having a foot in many worlds, to go from Lean to UX to Games to Edu.   I'm an intellectual wanderer.
cwodtke	666998221432975360	Wed Nov 18 07:15:42 PST 2015	I love the internet.  #flickr https://t.co/aInMVkTCMY
cwodtke	666826484753928192	Tue Nov 17 19:53:17 PST 2015	RT @TheWriteMunz: "Pooh?" said Piglet.  "Yes, Piglet?" said Pooh.  "Darmok and Jalad at Tanagra," said Piglet.  "Shaka, when the walls fell," …
cwodtke	666684553642176512	Tue Nov 17 10:29:18 PST 2015	Making notes on last years Story class, figuring out what I'll change, my heart starts to soar.     I love teaching things that matter.
cwodtke	666665437917134848	Tue Nov 17 09:13:21 PST 2015	RT @MichaelMJJohn: @cwodtke try this?  while(timer>0) {  //procedure   if( ballInGoal ) {    points++; //rule   kickoff();  //proc   }   timer--;…
cwodtke	666661241532739584	Tue Nov 17 08:56:40 PST 2015	If you plan to stand on the shoulders of giants, better get good at giant collecting.    Shout out to my giant collection of giant friends! :)
cwodtke	666657381581918208	Tue Nov 17 08:41:20 PST 2015	.@salliekrawcheck on why entrepreneurship has been tougher than Wall St. amid the financial crisis: https://t.co/y0k9i48VF6 via @FastCompany
cwodtke	666463697003372545	Mon Nov 16 19:51:42 PST 2015	I walked away form networking with important people to give my daughter her first omakaze, and I can't regret a thing.
cwodtke	666449516741005313	Mon Nov 16 18:55:21 PST 2015	Black cod in Amelie's first omakaze. https://t.co/FzhUwBIT9v
cwodtke	666449262503313408	Mon Nov 16 18:54:20 PST 2015	Salmon https://t.co/0uDRJGN38g
cwodtke	666441992545525761	Mon Nov 16 18:25:27 PST 2015	Second course of Amelie's first omakaze: yellowtail family travern https://t.co/IFHWpuxyR4
cwodtke	666437090947674112	Mon Nov 16 18:05:58 PST 2015	Amelie's first omakaze starts with toro. https://t.co/7OGfH2snPK
cwodtke	666421845160161280	Mon Nov 16 17:05:24 PST 2015	User w/motivation, inciting incident, struggles (competitor), crises, climax (product as hero), return home changed. https://t.co/yja6tvZoqU
cwodtke	666421319454560256	Mon Nov 16 17:03:18 PST 2015	RT @vinayakj: #leanstartup2015 @amyjokim Game Thinking - slack has a strong identity as a collaboration tool https://t.co/SXjAeKWfSK
cwodtke	666421271840686080	Mon Nov 16 17:03:07 PST 2015	RT @cindyalvarez: "Open-ended survey questions are bait for early adopters." -@amyjokim at #leanstartup2015
cwodtke	666411341947637761	Mon Nov 16 16:23:39 PST 2015	Clive Thompson on the Power of Visual Thinking https://t.co/ryxlJOdLYs via @WIRED
cwodtke	666401233222041600	Mon Nov 16 15:43:29 PST 2015	Want more fast and easy drawing techniques? Let me know by signing up! https://t.co/p8lrhklQ6y https://t.co/oWYFojMFwQ
cwodtke	666380027357884418	Mon Nov 16 14:19:13 PST 2015	RT @abuenosdias: @MichaelMJJohn @cwodtke In my insecurity about things being forgotten, I'd like to bring this to the top of minds: https:/…
cwodtke	666379802517987328	Mon Nov 16 14:18:20 PST 2015	RT @vinayakj: #leanstartup2015 @lauraklein @cwodtke recruit 5 more & repeat the exercise if what next 5 cant be predicted then pattern isnt…
cwodtke	666379775611568128	Mon Nov 16 14:18:13 PST 2015	RT @leanstartup: How can #DesignThinking help build your #LeanStartup? Small group brainstorms in @cwodtke & @lauraklein’s wkshp https://t.…
cwodtke	666379732284366848	Mon Nov 16 14:18:03 PST 2015	RT @vinayakj: #leanstartup2015 @lauraklein @cwodtke showed her skills at drawing visuals with a few lines and circles https://t.co/7NbvUeDe…
cwodtke	666379713330319360	Mon Nov 16 14:17:59 PST 2015	RT @leanstartup: “90% of the information we receive is visual. 65% of us are visual learners.” - @cwodtke #LeanStartup Conf https://t.co/fR…
cwodtke	666379677808750592	Mon Nov 16 14:17:50 PST 2015	RT @vinayakj: #leanstartup2015 @lauraklein @cwodtke demonstrated a framework to tell a story with sux stages https://t.co/NoA3OPwtvo
cwodtke	666379607654862848	Mon Nov 16 14:17:33 PST 2015	RT @ameellio: Big thanks @lauraklein @cwodtke for Design Thinking Workshop #leanstartup. Visualization, storytelling, more. 😄 https://t.co/…
cwodtke	666354485590028288	Mon Nov 16 12:37:44 PST 2015	RT @vinayakj: #leanstartup2015 @lauraklein @cwodtke- my drawing of 9 feelings https://t.co/Em8R33qXlz
cwodtke	666354467214770177	Mon Nov 16 12:37:39 PST 2015	RT @vinayakj: #leanstartup2015 @lauraklein @cwodtke Aspirational persona what the user would look like after using thd product https://t.co…
cwodtke	666354458092113922	Mon Nov 16 12:37:37 PST 2015	RT @vinayakj: #leanstartup2015 @lauraklein @cwodtke recruit 5 people who match the description and behavior& talk to them about problems , …
cwodtke	666352020064858112	Mon Nov 16 12:27:56 PST 2015	RT @leanstartup: Welcome to #LeanStartup Conference! We're excited to kickoff w/wkshps from @PhilD0210 @clevergirl @cwodtke @lauraklein @ac…
cwodtke	666351949030146048	Mon Nov 16 12:27:39 PST 2015	RT @vinayakj: #leanstartup2015 @lauraklein @cwodtke #leanstartup is not about throwing things on the wall and see what sticks. User centere…
cwodtke	666348518139805696	Mon Nov 16 12:14:01 PST 2015	Laura @lauraklein takes us through useful actionable personas at @leanstartup conference. #leanstartup15 https://t.co/GfChNReurb
cwodtke	666348141214498816	Mon Nov 16 12:12:31 PST 2015	RT @vinayakj: #leanstartup2015 @lauraklein @cwodtke empathy about understanding the user but its not enough. Marketing tends to make demogr…
cwodtke	666347083280986112	Mon Nov 16 12:08:19 PST 2015	Laura @lauraklein leads a packed room in the "I will always do user research pledge" at @leanstartup conference https://t.co/NWCF5qY53Q
cwodtke	666328102943916032	Mon Nov 16 10:52:54 PST 2015	The next book https://t.co/p8lrhklQ6y
cwodtke	666302855280652288	Mon Nov 16 09:12:34 PST 2015	Thrilled to be teaching https://t.co/ODFnjK1jB4 with my Stanford co-teacher, @lauraklein!    Can't make it? Let us bring it to your company!
cwodtke	666301662848421888	Mon Nov 16 09:07:50 PST 2015	RT @amyjokim: check out these great @leanstartup workshops today with @clevergirl, @lauraklein, @cwodtke, @cindyalvarez & others https://t.…
cwodtke	666260159388188672	Mon Nov 16 06:22:55 PST 2015	RT @metasynthie: Every talk at #practice15 so far has touched on the question of how to or how NOT to make players feel central, powerful, …
cwodtke	666258515732729856	Mon Nov 16 06:16:23 PST 2015	The Game Awards @thegameawards has 1 female judge of 52 and NO woman on the advisory board. How can they expect to represent games in 2015?
cwodtke	665565084094083072	Sat Nov 14 08:20:56 PST 2015	I was watching this https://t.co/AN2Unc1Hy6 and thought, I've seen talks like this but not by ppl whose work I so admire @mauvyrusset
cwodtke	665337924691492864	Fri Nov 13 17:18:17 PST 2015	RT @jarango: @cwodtke architecture offers lots of precedents. (IMO it’s a false dichotomy.)
cwodtke	665335739186442240	Fri Nov 13 17:09:36 PST 2015	I refuse to believe you can't have a vision driven and be user centered. In fact, reconciling these two is where greatness comes from
cwodtke	665332563574067200	Fri Nov 13 16:56:59 PST 2015	RT @MichaelMJJohn: @cwodtke @peterme @gretared Thus to suggest that any successful game designer is not user-centered, is folly.
cwodtke	665332323668226048	Fri Nov 13 16:56:01 PST 2015	RT @MichaelMJJohn: @cwodtke @peterme @gretared Games exist solely in the experience of the player. This is game design principle #1. Experi…
cwodtke	665332018062843904	Fri Nov 13 16:54:49 PST 2015	.@peterme @gretared Journey is a masterwork, it's designers are player centric. That's the deck I was referring to
cwodtke	665331637035536389	Fri Nov 13 16:53:18 PST 2015	.@peterme @gretared so ux has such a servant mentality that it dare not form a vision that could create a transcendent user experience?
cwodtke	665326371623714816	Fri Nov 13 16:32:22 PST 2015	RT @CliftonB: @cwodtke @gretared @peterme @jorge @miniver @yerbasuena If I dig a game dev, I know their games. If it's a UXer, I know their…
cwodtke	665325525095723009	Fri Nov 13 16:29:00 PST 2015	RT @HarvardBiz: Marissa Mayer Was Right to Ask Executives to Commit to Staying at Yahoo https://t.co/85P1ZowmqP
cwodtke	665325027819065348	Fri Nov 13 16:27:02 PST 2015	People, 140 characters. Cut me some slack here.
cwodtke	665271985975373824	Fri Nov 13 12:56:16 PST 2015	This conversation is still going on, still fascinating. https://t.co/k2qkSKZLXH
cwodtke	665209672849211392	Fri Nov 13 08:48:39 PST 2015	Need to procrastinate? In a friday state of mind? Want to discuss art and design?  https://t.co/qGW47ADX2x and https://t.co/KoAqCSOFU0
cwodtke	665189263475011584	Fri Nov 13 07:27:33 PST 2015	What's your poison
cwodtke	665054719732137985	Thu Nov 12 22:32:55 PST 2015	Terrific short essay https://t.co/D7nln2ISDl
cwodtke	665054207020371968	Thu Nov 12 22:30:53 PST 2015	RT @beccanalia: I hope not. I hope there’s enough room for the many bright lights who work in the disciplines to share their ideas. https:/…
cwodtke	665051259146145792	Thu Nov 12 22:19:10 PST 2015	Today I had two hard conversations and it made everything better for both parties (and me).     Always have the hard conversation.
cwodtke	665046732711964673	Thu Nov 12 22:01:11 PST 2015	Can I use the excuse that I'm teaching Play next semester to buy all the Fluxx variations?      I say yes.  https://t.co/sbYnZ5uqQd
cwodtke	665046217626411008	Thu Nov 12 21:59:08 PST 2015	RT @miniver: Maybe after we have actually implemented all of Doug Engelbart's ideas we will need a second genius   https://t.co/Y3Pq0M9eeY
